### ISSUE TITLE
Missing Networks

### ISSUE THREAD

**Issue by Erwan75** [troglobit/mrouted#23]
Hi,
I have setup it on two gentoo.
On the first gentoo, I have 192.168.253.0/24 and 192.168.252/24
On the second gentoo, I have 192.168.254.0/24.
(I have disable other networks).

First gentoo:
mrouted version 3.9.5 up  1:22:39 Sun Jan  7 19:46:18 2018

vifs_with_neighbors = 1
[This host is a leaf]

Virtual Interface Table
Vif  Name  Local-Address                               M  Thr  Rate   Flags
 0    br0  192.168.253.1   subnet: 192.168.253/24      1   1      0   querier leaf
           group host (time left): 239.255.255.246 192.168.253.127 ( 0:02:57)
                                   233.89.188.1    192.168.253.10  ( 0:02:55)
                                   239.255.255.250 192.168.253.200 ( 0:02:57)
                                   224.0.0.4       192.168.253.1   ( 0:02:55)
                                   224.0.0.2       192.168.253.1   ( 0:03:02)
                     IGMP querier: 192.168.253.1      (this system)
                      Nbr bitmaps: 0x0000000000000000
                   pkts/bytes in : 1883/619540
                   pkts/bytes out: 2050/799936

 1 br0.252  192.168.252.1   subnet: 192.168.252/24      1   1      0   querier leaf
           group host (time left): 233.89.188.1    192.168.252.11  ( 0:02:56)
                                   239.255.255.250 192.168.252.2   ( 0:02:56)
                                   224.0.0.4       192.168.252.1   ( 0:02:54)
                                   224.0.0.2       192.168.252.1   ( 0:02:55)
                     IGMP querier: 192.168.252.1      (this system)
                      Nbr bitmaps: 0x0000000000000000
                   pkts/bytes in : 2625/862886
                   pkts/bytes out: 36/12339

 2    br1  172.16.100.1    subnet: 172.16.100/24       1   1      0   disabled
                      Nbr bitmaps: 0x0000000000000000

 3   tun1  10.0.0.5        subnet: 10.0.0.5/32         1   1      0   disabled rexmit_prunes
                      Nbr bitmaps: 0x0000000000000000

 4   tun2  10.0.0.9        subnet: 10.0.0.9/32         1   1      0   disabled rexmit_prunes
                      Nbr bitmaps: 0x0000000000000000

 5   tun0  10.0.0.1        subnet: 10.0.0.1/32         1   1      0   disabled rexmit_prunes
                      Nbr bitmaps: 0x0000000000000000

 6    br0  192.168.253.1   tunnel: 192.168.254.1       1   1      0   rexmit_prunes old-tunnel
                            peers: 192.168.254.1 (3.255) [0] have-genid up  1:05:50
                      Nbr bitmaps: 0x0000000000000001
                   pkts/bytes in : 0/0
                   pkts/bytes out: 2018/787400

Multicast Routing Table (2 entries)
 Origin-Subnet      From-Gateway    Metric Tmr Fl In-Vif  Out-Vifs
 192.168.253/24                        1   165 ..   0    1*
 192.168.252/24                        1   165 ..   1    0* 6[0]

second gentoo:
mrouted version 3.9.5 up  1:00:52 Sun Jan  7 19:41:31 2018

vifs_with_neighbors = 1
[This host is a leaf]

Virtual Interface Table
Vif  Name  Local-Address                               M  Thr  Rate   Flags
 0    br0  192.168.254.1   subnet: 192.168.254/24      1   1      0   querier leaf
           group host (time left): 239.255.3.22    192.168.254.103 ( 0:03:53)
                                   239.255.255.250 192.168.254.110 ( 0:03:49)
                                   224.0.0.4       192.168.254.1   ( 0:03:48)
                                   224.0.0.2       192.168.254.1   ( 0:03:55)
                     IGMP querier: 192.168.254.1      (this system)
                      Nbr bitmaps: 0x0000000000000000
                   pkts/bytes in : 1557/290331
                   pkts/bytes out: 0/0

 1   tun0  10.0.1.1        subnet: 10.0.1.1/32         1   1      0   disabled rexmit_prunes
                      Nbr bitmaps: 0x0000000000000000

 2   tun1  10.0.1.5        subnet: 10.0.1.5/32         1   1      0   disabled rexmit_prunes
                      Nbr bitmaps: 0x0000000000000000

 3   tun3  10.0.0.2        subnet: 10.0.0.2/32         1   1      0   disabled rexmit_prunes
                      Nbr bitmaps: 0x0000000000000000

 4    br0  192.168.254.1   tunnel: 192.168.253.1       1   1      0   rexmit_prunes old-tunnel
                            peers: 192.168.253.1 (3.255) [0] have-genid up  1:01:03
                      Nbr bitmaps: 0x0000000000000001
                   pkts/bytes in : 0/0
                   pkts/bytes out: 0/0

Multicast Routing Table (2 entries)
 Origin-Subnet      From-Gateway    Metric Tmr Fl In-Vif  Out-Vifs
 192.168.254/24                        1    60 ..   0
 192.168.252/24     192.168.253.1      2     0 ..   4    0*

On the first, I can't see the second gentoo's network.
On the second, I can see only 192.168.252.0.

Do you know why and what can I do ?

Thanks

**Comment by troglobit** [comment]
Sorry, I don't get it.  How are the two routers connected?

**Comment by Erwan75** [comment]
Hello,
Thanks for your quick answer.
The two routers are connected by a dev tun (openvpn).

**Comment by Erwan75** [comment]
That is the shared network:
tun3: flags=4305<UP,POINTOPOINT,RUNNING,NOARP,MULTICAST>  mtu 1500
        inet 10.0.0.2  netmask 255.255.255.255  destination 10.0.0.1
        unspec 00-00-00-00-00-00-00-00-00-00-00-00-00-00-00-00  txqueuelen 100  (UNSPEC)
        RX packets 36835  bytes 14603426 (13.9 MiB)
        RX errors 0  dropped 0  overruns 0  frame 0
        TX packets 14655  bytes 2684069 (2.5 MiB)
        TX errors 0  dropped 0 overruns 0  carrier 0  collisions 0

I try to configure the tunnel with this IP 10.0.0.2 10.0.0.1, but I have the same issue.

**Comment by Erwan75** [comment]
Hi,
I have try with version 3.9.8 and it's ok : 
Multicast Routing Table (3 entries)
 Origin-Subnet      From-Gateway    Metric Tmr Fl In-Vif  Out-Vifs
 192.168.254/24                        1   170 ..   0    4[0]
 192.168.253/24     192.168.253.1      2    50 ..   4    0*
 192.168.252/24     192.168.253.1      2    50 ..   4    0*

But, I try tcpdump -i br0  ether multicast on the two routers, and I don't see multicast of other lan.

Thanks a lot

**Comment by Erwan75** [comment]
Hi
My final goal is to be able to "see" upnp servers (dlna) on the other side.
How can I check TTL ?

Thanks,

**Comment by Erwan75** [comment]
If I launch tcpdump on the shared network, I have : 
 tcpdump -i tun3 -n
tcpdump: verbose output suppressed, use -v or -vv for full protocol decode
listening on tun3, link-type RAW (Raw IP), capture size 65535 bytes
12:06:01.904785 IP 10.0.0.1 > 10.0.0.2: IP 192.168.252.2.2255 > 239.255.255.250.1900: UDP, length 327 (ipip-proto-4)
12:06:02.007800 IP 10.0.0.1 > 10.0.0.2: IP 192.168.252.2.2255 > 239.255.255.250.1900: UDP, length 327 (ipip-proto-4)
12:06:02.113234 IP 10.0.0.1 > 10.0.0.2: IP 192.168.252.2.2255 > 239.255.255.250.1900: UDP, length 336 (ipip-proto-4)

But I can see this packet on br0:
mrouted version 3.9.8 up  1:55:03 Mon Jan  8 12:07:16 2018

vifs_with_neighbors = 1
[This host is a leaf]


Virtual Interface Table
Vif  Name  Local-Address                               M  Thr  Rate   Flags
 0    br0  192.168.254.1   subnet: 192.168.254/24      1   1      0   querier leaf
           group host (time left): 239.255.3.22    192.168.254.105 ( 0:03:51)
                                   239.255.255.250 192.168.254.103 ( 0:03:52)
                                   224.0.0.4       192.168.254.1   ( 0:03:56)
                                   224.0.0.2       192.168.254.1   ( 0:03:56)
                     IGMP querier: 192.168.254.1      (this system)
                      Nbr bitmaps: 0x0000000000000000
                   pkts/bytes in : 1066/242297
                   pkts/bytes out: 0/0

 1   tun0  10.0.1.1        subnet: 10.0.1.1/32         1   1      0   disabled rexmit_prunes
                      Nbr bitmaps: 0x0000000000000000

 2   tun1  10.0.1.5        subnet: 10.0.1.5/32         1   1      0   disabled rexmit_prunes
                      Nbr bitmaps: 0x0000000000000000

 3   tun3  10.0.0.2        subnet: 10.0.0.2/32         1   1      0   querier leaf rexmit_prunes
                     IGMP querier: 10.0.0.2           (this system)
                      Nbr bitmaps: 0x0000000000000000

 4   tun3  10.0.0.2        tunnel: 10.0.0.1            1   1      0   rexmit_prunes old-tunnel
                            peers: 10.0.0.1 (3.255) [0] have-genid up  1:43:37
                      Nbr bitmaps: 0x0000000000000001
                   pkts/bytes in : 0/0
                   pkts/bytes out: 195/41582


Multicast Routing Table (4 entries)
 Origin-Subnet      From-Gateway    Metric Tmr Fl In-Vif  Out-Vifs
 10.0.0.2/32                           1   110 ..   3    0* 4[0]
 192.168.254/24                        1   110 ..   0    3* 4[0]
 192.168.253/24     10.0.0.1           2    20 ..   4    0* 3*
 192.168.252/24     10.0.0.1           2    20 ..   4    0* 3*

**Comment by troglobit** [comment]
I see, well SSDP is usually link-local only.  Use `wireshark` or `tcpdump -vvv` to see what the TTL is on the sending side. My Multicast Howto has some other tips if you really want to route link-local multicast http://troglobit.com/howto/multicast/

**Comment by troglobit** [comment]
To clarify what I mean. Routing multicast is one thing, but most of the time users just want to bridge two LANs and then a Layer-2 tunnel + bridge on both servers is a better solution.

**Comment by Erwan75** [comment]
Ok But If I bridge the two Lans, I will have the same gateway ?
Thanks

**Comment by troglobit** [comment]
For the two routers, yes. All other devices on the tow LANs can still use their own default route.

If the two routers are two PCs you also want to keep for other uses, which I'm guessing it is, then you could use two separate NICs and networks namespaces on the two PCs to handle bridging.

**Comment by troglobit** [comment]
(The "two separate NICs" can of course be virtual interfaces, e.g. untagged VLAN interface or similar, on top of your main interfaces)

**Comment by Erwan75** [comment]
You main, it's a good solution to have on one of my router a network card on the lan of the other router ?

**Comment by troglobit** [comment]
Sure, then it could bridge those LANs. That's essentially what a Layer-2 tunnel does.

**Comment by Erwan75** [comment]
Thanks for your help.
With this tunnel, I have to use mrouted to have multicast on all my network ?

This solution can work too:
iptables -t mangle -A OUTPUT -d 225.1.2.3 -j TTL --ttl-set 128 
??

Thanks

**Comment by troglobit** [comment]
Like I said, you can bridge multiple layer-2 networks, *or* you can route the multicast.  If you chose the latter you'll have to mangle the TTL field, yes.

**Comment by Erwan75** [comment]
Thanks for all and sorry, I have difficult with english.
I prefer route, so I have to mangle.

I would like to have this packet on the other side:
13:14:58.973257 IP (tos 0x0, ttl 255, id 4029, offset 0, flags [DF], proto UDP (17), length 111)
    192.168.254.254.5353 > 224.0.0.251.5353: [udp sum ok] 0 [2q] SRV (QM)? 0024D4AFDB7E@Freebox Server._raop._tcp.local. A (QM)? Freebox-Server.local. (83)
13:14:58.973982 IP (tos 0x0, ttl 255, id 4030, offset 0, flags [DF], proto UDP (17), length 135)
    192.168.254.254.5353 > 224.0.0.251.5353: [udp sum ok] 0*- [0q] 2/0/0 Freebox-Server.local. (Cache flush) [2m] A 192.168.254.254, 0024D4AFDB7E@Freebox Server._raop._tcp.local. (Cache flush) [2m] SRV Freebox-Server.local.:5000 0 0 (107)

So I have added this rule:
iptables -t mangle -L -v
Chain PREROUTING (policy ACCEPT 22477 packets, 5416K bytes)
 pkts bytes target     prot opt in     out     source               destination
  200 34933 TTL        all  --  any    any     anywhere             224.0.0.251          TTL increment by 10

But I have nothing on the other side :-(

**Comment by Erwan75** [comment]
Not better :-(

**Comment by Erwan75** [comment]
Hello,
Thanks again for your help. I have changed tun to tap for my openvpn.
And now I can see multicast on all my networks !

But I can't see my dlna server ....

I think it's not a mrouted issue, so It's ok.

Regards

**Comment by troglobit** [comment]
Unfortunately I have no experience with DLNA, but I suspect that it may be a unicast routing problem.  

Do you think we can close this issue with mrouted now?

**Comment by Erwan75** [comment]
Oh yes !
Thanks a lot for everything.
De : Joachim Nilsson [mailto:notifications@github.com]
Envoyé : mardi 9 janvier 2018 10:45
À : troglobit/mrouted <mrouted@noreply.github.com>
Cc : Erwan75 <erwan@rigollot.me>; Author <author@noreply.github.com>
Objet : Re: [troglobit/mrouted] Missing Networks (#23)


Unfortunately I have no experience with DLNA, but I suspect that it may be a unicast routing problem.

Do you think we can close this issue with mrouted now?

**Comment by troglobit** [comment]
OK, closing. Good Luck!
